{
  "required" : true ,
  "$schema" : "http://json-schema.org/draft-03/schema" ,
  "type" : "object" ,
  "properties" : {
    "href" : {
      "type" : "string" ,
      "required" : false
    } ,
    "offset" : {
      "type" : "number" ,
      "required" : false
    } ,
    "limit" : {
      "type" : "number" ,
      "required" : false
    } ,
    "items" : {
      "type" : "array" ,
      "required" : false ,
      "items" : [
        {
          "type" : "object" ,
          "properties" : {
            "href" : {
              "type" : "string" ,
              "required" : false
            } ,
            "name" : {
              "type" : "string" ,
              "required" : false
            } ,
            "description" : {
              "type" : "string" ,
              "required" : false
            } ,
            "status" : {
              "type" : "string" ,
              "required" : false
            } ,
            "directory" : {
              "type" : "object" ,
              "required" : false ,
              "properties" : {
                "href" : {
                  "type" : "string" ,
                  "required" : false
                }
              }
            } ,
            "tenant" : {
              "type" : "object" ,
              "required" : false ,
              "properties" : {
                "href" : {
                  "type" : "string" ,
                  "required" : false
                }
              }
            } ,
            "accounts" : {
              "type" : "object" ,
              "required" : false ,
              "properties" : {
                "href" : {
                  "type" : "string" ,
                  "required" : false
                }
              }
            } ,
            "accountMemberships" : {
              "type" : "object" ,
              "required" : false ,
              "properties" : {
                "href" : {
                  "type" : "string" ,
                  "required" : false
                }
              }
            }
          }
        }
      ]
    }
  }
}