{
  "href" : "https://api.stormpath.com/v1/accounts/MvdTIJakRO2Ry8c5z5itWw/groupMemberships" ,
  "offset" : 0 ,
  "limit" : 25 ,
  "items" : [
    {
      "href" : "https://api.stormpath.com/v1/groupMemberships/36KuRJcsfiHZjCR0Trv4yJ" ,
      "account" : {
        "href" : "https://api.stormpath.com/v1/accounts/MvdTIJakRO2Ry8c5z5itWw"
      } ,
      "group" : {
        "href" : "https://api.stormpath.com/v1/groups/tKP_30-9TcCneD3ktBwcig"
      }
    } , {
      "href" : "https://api.stormpath.com/v1/groupMemberships/1kjD3owGFAAzoGhFsO1oLz" ,
      "account" : {
        "href" : "https://api.stormpath.com/v1/accounts/MvdTIJakRO2Ry8c5z5itWw"
      } ,
      "group" : {
        "href" : "https://api.stormpath.com/v1/groups/smJGMBMpQ_-FKvMgCRTdVA"
      }
    }
  ]
}