{
  "href" : "https://api.stormpath.com/v1/applications/5D26Bl8lHTct1FDCHrltc3/accountStoreMappings" ,
  "offset" : 0 ,
  "limit" : 25 ,
  "items" : [
    {
      "href" : "https://api.stormpath.com/v1/accountStoreMappings/XpM9nyZ2TbaEzfbRvLk9KA"
    } , {
      "href" : "https://api.stormpath.com/v1/accountStoreMappings/aLlyOUrBAse34js9hjiH9j"
    } , {
      "href" : "https://api.stormpath.com/v1/accountStoreMappings/Xhf0a9HLA02djsdP90dsQ2"
    }
  ]
}